{"schemaVersion":1,"playId":"othello","versionId":"folger","sourceId":"generated","terms":[{"id":"generated:ftln-0004:1","anchor":{"start":{"nodeId":"ftln-0004","offset":1},"end":{"nodeId":"ftln-0004","offset":7},"quote":{"exact":"Sblood","prefix":"’","suffix":", but you’ll not hea"},"revision":"sha256:5ac9a88e06b139fa"},"headword":"Sblood","definitions":[{"meaning":"An oath, short for 'by God's blood'; an exclamation of anger or impatience.","partOfSpeech":"interjection"}]},{"id":"generated:ftln-0026:18","anchor":{"start":{"nodeId":"ftln-0026","offset":18},"end":{"nodeId":"ftln-0026","offset":25},"quote":{"exact":"consuls","prefix":"Wherein the togèd ","suffix":" can propose"},"revision":"sha256:5ac9a88e06b139fa"},"headword":"consuls","definitions":[{"meaning":"Senators or civil officials of state (wearing togas), as opposed to soldiers; statesmen with no battle experience.","partOfSpeech":"noun"}]},{"id":"generated:ftln-0033:3","anchor":{"start":{"nodeId":"ftln-0033","offset":3},"end":{"nodeId":"ftln-0033","offset":10},"quote":{"exact":"debitor","prefix":"By ","suffix":" and creditor. This "},"revision":"sha256:5ac9a88e06b139fa"},"headword":"debitor","definitions":[{"meaning":"Debit side of an account book; Iago sneers at Cassio as a mere bookkeeper, a man of figures rather than battle.","partOfSpeech":"noun"}]},{"id":"generated:ftln-0053:20","anchor":{"start":{"nodeId":"ftln-0053","offset":20},"end":{"nodeId":"ftln-0053","offset":26},"quote":{"exact":"knaves","prefix":"Whip me such honest ","suffix":"! Others there are"},"revision":"sha256:5ac9a88e06b139fa"},"headword":"knaves","definitions":[{"meaning":"Servants or menials; here also with a hint of fools or dupes.","partOfSpeech":"noun"}]},{"id":"generated:ftln-0060:0","anchor":{"start":{"nodeId":"ftln-0060","offset":0},"end":{"nodeId":"ftln-0060","offset":4},"quote":{"exact":"soul","prefix":"","suffix":","},"revision":"sha256:5ac9a88e06b139fa"},"headword":"soul","definitions":[{"meaning":"spirit, mettle; good sense","partOfSpeech":"noun"}]},{"id":"generated:ftln-0063:11","anchor":{"start":{"nodeId":"ftln-0063","offset":11},"end":{"nodeId":"ftln-0063","offset":15},"quote":{"exact":"Moor","prefix":"Were I the ","suffix":" I would not be Iago"},"revision":"sha256:5ac9a88e06b139fa"},"headword":"Moor","definitions":[{"meaning":"A person of North African or Arab descent, loosely used for any dark-skinned African; here Othello, the Venetian general.","partOfSpeech":"noun"}]},{"id":"generated:ftln-0085:20","anchor":{"start":{"nodeId":"ftln-0085","offset":20},"end":{"nodeId":"ftln-0085","offset":27},"quote":{"exact":"Signior","prefix":"What ho, Brabantio! ","suffix":" Brabantio, ho!"},"revision":"sha256:5ac9a88e06b139fa"},"headword":"Signior","definitions":[{"meaning":"Italian title of respect for a gentleman, used before a name; equivalent to Sir or Mr.","partOfSpeech":"noun"}]},{"id":"generated:ftln-0091:0","anchor":{"start":{"nodeId":"ftln-0091","offset":0},"end":{"nodeId":"ftln-0091","offset":7},"quote":{"exact":"Signior","prefix":"","suffix":", is all your family"},"revision":"sha256:5ac9a88e06b139fa"},"headword":"Signior","definitions":[{"meaning":"Respectful form of address to a gentleman; sir.","partOfSpeech":"noun"}]},{"id":"generated:ftln-0110:38","anchor":{"start":{"nodeId":"ftln-0110","offset":38},"end":{"nodeId":"ftln-0110","offset":46},"quote":{"exact":"draughts","prefix":"er and distemp’ring ","suffix":","},"revision":"sha256:5ac9a88e06b139fa"},"headword":"draughts","definitions":[{"meaning":"Drinks of alcohol, gulps of liquor (here intoxicating ones that unsettle the mind).","partOfSpeech":"noun"}]},{"id":"generated:ftln-0121:19","anchor":{"start":{"nodeId":"ftln-0121","offset":19},"end":{"nodeId":"ftln-0121","offset":23},"quote":{"exact":"soul","prefix":"In simple and pure ","suffix":" I come to you—"},"revision":"sha256:5ac9a88e06b139fa"},"headword":"soul","definitions":[{"meaning":"sincere, honest intention","partOfSpeech":"noun"}]},{"id":"generated:ftln-0168:46","anchor":{"start":{"nodeId":"ftln-0168","offset":46},"end":{"nodeId":"ftln-0168","offset":51},"quote":{"exact":"souls","prefix":"ct, that, for their ","suffix":","},"revision":"sha256:5ac9a88e06b139fa"},"headword":"souls","definitions":[{"meaning":"An oath-like phrase: even to save their lives; for anything they could do, however hard they tried.","partOfSpeech":"phrase"}]},{"id":"generated:ftln-0176:12","anchor":{"start":{"nodeId":"ftln-0176","offset":12},"end":{"nodeId":"ftln-0176","offset":21},"quote":{"exact":"Sagittary","prefix":"Lead to the ","suffix":" the raisèd search,"},"revision":"sha256:5ac9a88e06b139fa"},"headword":"Sagittary","definitions":[{"meaning":"An inn or lodging house in Venice, named from its sign of the archer (the centaur Sagittarius), where Othello and Desdemona are staying.","partOfSpeech":"noun"}]},{"id":"generated:ftln-0193:39","anchor":{"start":{"nodeId":"ftln-0193","offset":39},"end":{"nodeId":"ftln-0193","offset":45},"quote":{"exact":"charms","prefix":"m act.—Is there not ","suffix":""},"revision":"sha256:5ac9a88e06b139fa"},"headword":"charms","definitions":[{"meaning":"magic spells; enchantments that can bewitch someone","partOfSpeech":"noun"}]},{"id":"generated:ftln-0227:34","anchor":{"start":{"nodeId":"ftln-0227","offset":34},"end":{"nodeId":"ftln-0227","offset":42},"quote":{"exact":"signiory","prefix":"ich I have done the ","suffix":""},"revision":"sha256:5ac9a88e06b139fa"},"headword":"signiory","definitions":[{"meaning":"The governing authority of Venice; the Doge and senators as the state's rulers.","partOfSpeech":"noun"}]},{"id":"generated:ftln-0235:15","anchor":{"start":{"nodeId":"ftln-0235","offset":15},"end":{"nodeId":"ftln-0235","offset":23},"quote":{"exact":"unhousèd","prefix":"I would not my ","suffix":" free condition"},"revision":"sha256:5ac9a88e06b139fa"},"headword":"unhousèd","definitions":[{"meaning":"unconfined, without a household or domestic ties; unmarried and free to roam","partOfSpeech":"adjective"}]},{"id":"generated:ftln-0242:35","anchor":{"start":{"nodeId":"ftln-0242","offset":35},"end":{"nodeId":"ftln-0242","offset":39},"quote":{"exact":"soul","prefix":"tle, and my perfect ","suffix":""},"revision":"sha256:5ac9a88e06b139fa"},"headword":"soul","definitions":[{"meaning":"clear conscience; blameless inner self","partOfSpeech":"noun"}]},{"id":"generated:ftln-0278:0","anchor":{"start":{"nodeId":"ftln-0278","offset":0},"end":{"nodeId":"ftln-0278","offset":7},"quote":{"exact":"Signior","prefix":"","suffix":", it is the Moor."},"revision":"sha256:5ac9a88e06b139fa"},"headword":"Signior","definitions":[{"meaning":"Respectful form of address to a gentleman; sir.","partOfSpeech":"noun"}]},{"id":"generated:ftln-0284:5","anchor":{"start":{"nodeId":"ftln-0284","offset":5},"end":{"nodeId":"ftln-0284","offset":12},"quote":{"exact":"signior","prefix":"Good ","suffix":", you shall more com"},"revision":"sha256:5ac9a88e06b139fa"},"headword":"signior","definitions":[{"meaning":"Respectful form of address to a gentleman; sir.","partOfSpeech":"noun"}]},{"id":"generated:ftln-0298:42","anchor":{"start":{"nodeId":"ftln-0298","offset":42},"end":{"nodeId":"ftln-0298","offset":48},"quote":{"exact":"charms","prefix":"ed on her with foul ","suffix":","},"revision":"sha256:5ac9a88e06b139fa"},"headword":"charms","definitions":[{"meaning":"magic spells; enchantments that can bewitch someone","partOfSpeech":"noun"}]},{"id":"generated:ftln-0349:3","anchor":{"start":{"nodeId":"ftln-0349","offset":3},"end":{"nodeId":"ftln-0349","offset":10},"quote":{"exact":"Signior","prefix":"By ","suffix":" Angelo."},"revision":"sha256:5ac9a88e06b139fa"},"headword":"Signior","definitions":[{"meaning":"Italian title of respect for a gentleman, used before a name; equivalent to Sir or Mr.","partOfSpeech":"noun"}]},{"id":"generated:ftln-0349:11","anchor":{"start":{"nodeId":"ftln-0349","offset":11},"end":{"nodeId":"ftln-0349","offset":17},"quote":{"exact":"Angelo","prefix":"By Signior ","suffix":"."},"revision":"sha256:5ac9a88e06b139fa"},"headword":"Angelo","definitions":[{"meaning":"A Venetian gentleman, apparently a naval commander, who sent the sailor with news of the Turkish fleet; he does not appear in the play.","partOfSpeech":"noun"}]},{"id":"generated:ftln-0368:4","anchor":{"start":{"nodeId":"ftln-0368","offset":4},"end":{"nodeId":"ftln-0368","offset":13},"quote":{"exact":"Ottomites","prefix":"The ","suffix":", Reverend and Graci"},"revision":"sha256:5ac9a88e06b139fa"},"headword":"Ottomites","definitions":[{"meaning":"The Ottoman Turks, i.e. the forces of the Turkish Empire, Venice's enemy.","partOfSpeech":"noun"}]},{"id":"generated:ftln-0375:30","anchor":{"start":{"nodeId":"ftln-0375","offset":30},"end":{"nodeId":"ftln-0375","offset":37},"quote":{"exact":"Signior","prefix":"oses toward Cyprus. ","suffix":" Montano,"},"revision":"sha256:5ac9a88e06b139fa"},"headword":"Signior","definitions":[{"meaning":"Italian title of respect for a gentleman, used before a name; equivalent to Sir or Mr.","partOfSpeech":"noun"}]},{"id":"generated:ftln-0380:0","anchor":{"start":{"nodeId":"ftln-0380","offset":0},"end":{"nodeId":"ftln-0380","offset":6},"quote":{"exact":"Marcus","prefix":"","suffix":" Luccicos, is not he"},"revision":"sha256:5ac9a88e06b139fa"},"headword":"Marcus","definitions":[{"meaning":"First name of Marcus Luccicos, a man (apparently a Venetian soldier or agent) whom the Duke wants summoned; he never appears in the play.","partOfSpeech":"noun"}]},{"id":"generated:ftln-0380:7","anchor":{"start":{"nodeId":"ftln-0380","offset":7},"end":{"nodeId":"ftln-0380","offset":15},"quote":{"exact":"Luccicos","prefix":"Marcus ","suffix":", is not he in town?"},"revision":"sha256:5ac9a88e06b139fa"},"headword":"Luccicos","definitions":[{"meaning":"Surname of Marcus Luccicos, a Venetian (probably a Greek or soldier familiar with Cyprus) whom the Duke wants to consult; he is otherwise unknown.","partOfSpeech":"noun"}]},{"id":"generated:ftln-0437:0","anchor":{"start":{"nodeId":"ftln-0437","offs